DID,Name,Designation,Specialities,Branch
PDC-472,PROF. DR. TOUHIDA AHSAN,"MBBS, FCPS, MS(Obs & Gynae), Infertility Specialist, Laparoscopic & Hysteroscopic surgeon EX-Prof. IBN SINA Medical College & Hospital. Dhaka. BMDC. Reg: A-13202",Gynaecology,Gazipur
PDC-473,ASST. PROF. DR. ISHRAT JAHAN,"MBBS,FCPS,MS (Salimullah,Mitford Hospital)",Gynaecology,Shantinagar
PDC-474,DR. MST. FERDEWSI BEGUM,"MBBS, BCS(Health), FCPS(Gynea&Obs), Consultant, Mymensingh Medical College Hospital",Gynaecology,Mymensingh
PDC-475,DR. SHOHELA PARVEEN,,Gynaecology,Mirpur
PDC-476,DR. SADIA AFRIN MUNMUN,,Gynaecology,Gazipur
PDC-477,DR. SWAPNA RANI SARKAR,,Gynaecology,Gazipur
PDC-478,DR. NISHAT ANAM BORNA,"MBBS, BCS (Health), MCPS (Gynae) , FCPS (Obs & Gynae), Consultant, Gynae & Obs, Rajshahi Medical College & Hospital",", Gynaecology",Rajshahi
PDC-479,DR. NASIMA SULTANA,,Gynaecology,Badda
PDC-480,DR. UMA NAG (SHAMPA),,Gynaecology,Barisal
PDC-481,DR. SIMA BASAK,,Gynaecology,Dinajpur
PDC-482,ASSO. PROF. DR. LAILO NAHAR,"MBBS (Dhaka); DGO (DEU); MCPS (Gynaecology); FCPS (Gynaecology); Gynaecologist & Surgeon, Asso. Prof. Comilla Medical College Hospital, Comilla.",Gynaecology,Noakhali
PDC-483,ASSO. PROF. DR. TAHERA BEGUM,,Gynaecology,Chattogram
PDC-484,PROF. DR. MAFRUHA KHANAM PORAG,,Gynaecology,Chattogram
PDC-485,ASST. PROF. DR. FAHMIDA RASHID (SWATI),,Gynaecology,Chattogram
PDC-486,DR. MUNJURA CHOWDHURY,,Gynaecology,Chattogram
PDC-487,DR. NAZ SHOHANI SULTANA,,Gynaecology,Chattogram
PDC-488,DR. SHAMIMA AKHTER,,Gynaecology,Chattogram
PDC-489,DR. SHAHANA YESMEN,,Gynaecology,Chattogram
PDC-490,DR. TASLIM CHOWDHURY,,Gynaecology,Chattogram
PDC-491,DR. SATHY KHANAM,"MBBS, MS",Gynaecology,Narayangonj
PDC-492,DR. MAHMUDA BEGUM,Senior Consultant,Gynaecology,Uttara
PDC-493,DR. SOME ROSE PERVIN (RINKU),"MBBS, BCS (Health), DGO (BSMMU) FCPS (Obs&Gynae), Consultant, Laparoscopic & Hysteroscopic Surgeon Rajshahi Medical College & Hospital",Gynaecology,Rajshahi
PDC-494,DR. KHADIJA MANNAN,,Gynaecology,Mirpur
PDC-495,DR. SADIA AMIN,,Gynaecology,Barisal
PDC-496,DR. ISMAT ARA JEMY,"MBBS, BCS (Health), FCPS (Obs&Gynae), Consultant, Gynae & Obs, Rajshahi Medical College & Hospital",Gynaecology,Rajshahi
PDC-497,DR. M.K. SHELLY,"MBBS, DGO, MCPS",Gynaecology,English road
PDC-498,DR. SANJIDA PARVEEN,,Gynaecology,Dhanmondi
PDC-499,ASST. PROF. DR. SABRIN FORHAD,,Gynaecology,Uttara
PDC-500,DR. DINA LAYLA HOSSAIN,,Gynaecology,Badda
PDC-501,DR. NAHID AKTER,,Gynaecology,Kurigram
PDC-502,DR. FEROJA BANU SHERIN,,Gynaecology,Bogura
PDC-503,DR. ROMENA AFROJ,Consultant,Gynaecology,Uttara
PDC-504,DR. TAHMINA DEWAN,,Gynaecology,Chattogram
PDC-505,DR. FAZILATUNNESA KUSUM,,Gynaecology,Badda
PDC-506,DR. SALMA AKTHER (LAIZU),"MBBS (DU), BCS(Health), DGO (BSMMU), MCPS (Gynae & Obs), FCPS (Gynae & Obs), Consultant (Gynae). Mymensingh Medical College Hospital.",Gynaecology,Mymensingh
PDC-507,DR. SUMONA AFRIN,,Gynaecology,Kushtia
PDC-508,DR. FARZANA AKTER,,Gynaecology,English road
PDC-509,DR. MST. SURAYA KHATUN,"MBBS (DMC), BCS (Health), FCPS (Obs & Gynae), Mymensingh Medical College & Hospital,Mymensingh.",Gynaecology,Mymensingh
PDC-510,DR. RUBINA AKTER,,Gynaecology,Uttara
PDC-511,ASSO. PROF. DR. FIROZA BEGUM,"MBBS, DGO. MS (Gynae & Obs), Associate Professor Ex (Gynae & Obs), Mymensingh Medical College Hospital",Gynaecology,Mymensingh
PDC-512,DR. ZOBAYDA GULSUN ARA (SWEETY),,Gynaecology,Dinajpur
PDC-513,PROFESSOR. DR. FARZANA SOHAEL,"MBBS,FCPS(Gynae & Obs), Special Fellowship Training in Infertility(Japan), Professor & Head of The Department (Gynaecology).Shaheed Suhrawardy Medical College & Hospital,Dhaka--1207",Gynaecology,Shyamoli
PDC-514,DR. NAZNEEN AHMAD,,Gynaecology,Chattogram
PDC-515,DR. TAHMINA BEGUM,"MBBS; BCS (Health); MCPS (Gaynae & Obs); DGO; Consultent, 250 Bed General Hospital, Noakhali.",Gynaecology,Noakhali
PDC-516,DR. CHHANDA MAJUMDER,"MBBS, FCPS (Gynae & Obs), CCD (BIRDEM), CMU (Ultra), Consultant, Popular Diagnostic Center Ltd.",Gynaecology,Dhanmondi
PDC-517,DR.TASLIMA AKTER,,Gynaecology,Uttara
PDC-518,DR. MOUMITA TRIPURA MUMU,,Gynaecology,Chattogram
PDC-519,PROF. DR. SHIREEN AKHTER KHANAM,,Gynaecology,Chattogram
PDC-520,DR. KHADIJA BEGUM,,Gynaecology,Chattogram
PDC-521,DR. NASIMA BEGUM,,Gynaecology,Chattogram
PDC-522,ASSTT. PROF. DR. NAHID SULTANA,"MBBS,BCS,(Health) Fcps(Obs & Gynae)Gynaecologist Specialist & Surgeon. Assistant Professor (Gynae & Obs) Rajshahi Medical College & Hospital .",Gynaecology,Rajshahi
PDC-523,DR. FATEMA JOAN MUNIA,"MBBS (DMC); BCS (Health); FCPS (Gynae & Obs); Medical Officer, 250 Bed General Hospital, Noakhali.",Gynaecology,Noakhali
PDC-524,DR. SHEIKH TASNUVA ALAM,"MBBS. ( DU), MS (Gynae & Obs) Specialist & Surgeon (Gynae & Obs) Khulna Medical College Hospital",Gynaecology,Khulna
PDC-525,ASSO. PROF. DR. SAHANA RAZZAQUE ALI,"MBBS, MCPS,DGO Laparoscopic Surgeon. Asso. Prof.(Gynae & Obs) (Retirement) Khulna Medical college Hospital, Khulna.",Gynaecology,Khulna
PDC-526,DR. MST. PARUL AKTER,"MBBS, BCS (Health) FCPS (Obs & Gynae) MCPS ( obs & Gynae) Khulna Medical college Hospital. Khulna.",Gynaecology,Khulna
PDC-527,DR. SALMA SULTANA,,Gynaecology,Bogura
PDC-528,DR. TARAFDAR RUNA LAILA,"FCPS, MS ( Gynae & Obs) Gold Medalist, Highly Trained in Infertility (India), Associate Professor, Gynae & Obs Department, Bangabandhu Sheikh Mujib Medical University, Dhaka.",Gynaecology,Dhanmondi
PDC-529,DR.AFREEN KABIR KHEYA,MBBS.FCPS,Gynaecology,English road
PDC-530,DR. MITHEEL -IBNA ISLAM,"MBBS, BCS (Health), DGO, FCPS ( Obs & Gynae) Khulna Medical College Hospital.",Gynaecology,Khulna
PDC-531,ASSO. PROF. DR. SAHANA RAZZAQUE ALI (EVENING),"MBBS, MCPS, DGO, Laparoscopic Surgeon. Asso. Prof.(Gynae & Obs) (Retirement) Khulna Medical college Hospital, Khulna.",Gynaecology,Khulna
PDC-532,PROF. DR. DILRUBA AKTER,"MBBS, FCPS (Gynae), Fellowship-FIGO (Malaysia), Gynae Specialist & Laparoscopic Surgeon. Special Training in Infertility & Hysteroscopy ( Malaysia & London). Director & Head Department of (OBGYN), ICMH, Matuail, Dhaka.",Gynaecology,Dhanmondi
PDC-533,MAJOR. (DR) TAFAZZULA TASNIM,,Gynaecology,Gazipur
PDC-534,DR. SAIMA SULTANA,"MBBS(SSMC & MH), DGO(DMCH), CCD BMDC Reg No:- A-45997",Gynaecology,Narayangonj
PDC-535,DR. T H JOHURA MUNMUN,,Gynaecology,Mirpur
PDC-536,DR. GOPA KUNDU (BONNA),"MBBS(DMC), BCS(Health), FCPS(Obs & Gyane), FCPS(Gynecological Oncology) Consultant Obs & Gyane. Current Posting:-National Institute of Cancer Research & Hospital(NICRH). Mohakhali, Dhaka.","Gynae Oncology, Gynaecology",Narayangonj
PDC-537,DR. ISRAT JAHAN,"MBBS,FCPS (Obs & Gynae),FCPS (Reproductive Endocrinology & Infertility)",Gynaecology,Shantinagar
PDC-538,DR. ZEENAT REHENA JHARNA,,Gynaecology,Chattogram
PDC-539,DR. PARVEEN AKHTER SHAMSUN NAHAR (SUROVI),"MBBS, FCPS (Gynae & Obs), MRCOG 2nd Part (London), Trained in Advanced Gynae-Laparoscopic Surgeon, Urogynaecology & Infertility (India, Singapore). Associate Prof. Dept. of Gynaecology- BSMMU, Dhaka.",Gynaecology,Dhanmondi
PDC-540,ASST. PROF. DR. RIFAT ARA,"MBBS, FCPS(Gynae),,MS(Gynae), FCPS(Oncology), Mohakhali Cancer Hospital, Dhaka.","Gynaecology, Gynae Oncology",Gazipur
PDC-541,PROF. DR. MERINA KHANOM,"MBBS, FCPS (Gynae & Obs), Consultant, Gynae & Obs, Infertility & Gynae Specialist, Ex.- Professor, Dhaka Medical College & Hospital, Popular Diagnostic Center, Dhanmondi, Dhaka.",Gynaecology,Dhanmondi
PDC-542,ASSO. PROF. DR. JUTHI BHOWMIK,"MBBS, FCPS (Gynae & Obs) (Institute for Women and Child Health)",Gynaecology,Shantinagar
PDC-543,DR. BENJIR HAQUE PANNA,"MBBS, DGO (BSMMU), FCPS (Obs & Gynae), FMAS (India), Obs & Gynae Specialist & Laparoscopic Surgeon, Assistant Professor, Obs & Gynae Department, Popular Medical College & Hospital, Dhaka.",Gynaecology,Dhanmondi
PDC-544,ASSO. PROF. DR. MASUDA ISLAM KHAN,,Gynaecology,Mirpur
PDC-545,DR. SHAFIA AFRIN,MBBS.BCS(Health) FCPS ( Obs & Gynae ) Consultant Department of Gynaecology. Mugda Medical College & hospital .Dhaka,Gynaecology,Shyamoli
PDC-546,DR. DILARA PARVIN (DIPA),,Gynaecology,Chattogram
PDC-547,PROF. DR. SABINA HUSEIN,,Gynaecology,Mirpur
PDC-548,DR. FARJANA AFROSE (REMU),,Gynaecology,Shyamoli
PDC-549,DR PRATIMA RANI TRIPURA,,Gynaecology,Chattogram
PDC-550,DR. MST.KAMRUN NAHAR RIKTA,,Gynaecology,Kushtia
PDC-551,DR. ISRAT SHARMIN BARNA,,Gynaecology,Barisal
PDC-552,DR. SHAHANA PARVIN (RITU),"MBBS.BCS (Health), FCPS (Gynae & Obs), Consultant , Popular Diagnostic Centre Ltd",Gynaecology,Rajshahi
PDC-553,DR. SABRINA ISLAM,"MBBS(CMC), BCS(Health),FCPS(Gyne and Obs), Chattogram Medical College Hospital",Gynaecology,Chattogram
PDC-554,DR. INDRANI NAG,,Gynaecology,Badda
PDC-555,PROF. DR. SHAHI FARZANA TASMIN,"MBBS, FCPS (Gynaeclolgy) Ex. Prof. of Gynaeclolgy. Rangpur Medical College Hospital.",Gynaecology,Dhanmondi
PDC-556,ASSOT. PROF. DR. SABINA PARVEEN,,Gynaecology,Badda
PDC-557,DR. NAHIDA NAZNIN,"MBBS, FCPS, MCPS, MS (Gynae), Diploma in Obs & Gynae, MPH Dhaka, Trained Infertility & Laparoscopic Surgery. Gynaecologist & Director -Azimpur Maternity Hospital, Dhaka.",Gynaecology,Dhanmondi
PDC-558,DR. NAZIA AHMED,,Gynaecology,Badda
PDC-559,PROF. DR. SHAHI FARZANA TASMIN (MORNING),Professor,Gynaecology,Rangpur
PDC-560,DR.MAFRUHA TAZKIN MILKY,,Gynaecology,Savar
PDC-561,DR. MUSFIQA IFFAT (LABONI),"MBBS, BCS, FCPS (Obs & Gynae) Consultant (Gynae & Obs) Khulna Medical College Hospital, Khulna. BMDC Reg. No- A-42900.",Gynaecology,Khulna
PDC-562,DR. FARZANA AKTER BITHI,,Gynaecology,Chattogram
PDC-563,ASSTT. PROF. DR. SALMA ARJUMAND BANU,"MBBS, DGO, MCPS(Gyne), Assistant Professor Gynaeologist (Rtd)& Surgeon , Rajshahi Medical College & Hospital",Gynaecology,Rajshahi
PDC-564,DR. PRIYANKA WADDADER,,Gynaecology,Chattogram
PDC-565,DR. RAWSHAN AKHTAR (BIPLOBI),"MBBS, BCS (Health) MS (Gynae & Obs)Assistant Professor, Derpartmant of Gynae & Obs, Rajshahi Medical College Hospital",Gynaecology,Rajshahi
PDC-566,DR. FARJANA BASHER SHILPI,,Gynaecology,Chattogram
PDC-567,DR. JEBUNNESA ANI,"MBBS, BCS, MCPS, FCPS (Gyne & Obs) , Consultant, Gynecology and Obstetrics Specialist and Laparoscopic & Hysteroscopic Surgeon, Rajshahi Medical College Hospital, Rajshahi",Gynaecology,Rajshahi
PDC-568,ASSO. PROF. DR. PARUL AKHTAR,"MBBS,FCPS (Sir Salimullah Medical College & Mitford Hospital)",Gynaecology,Shantinagar
PDC-569,PROF. DR. DILRUBA AKHTER,MBBS. FCPS(Gynae). Fellow Ship-Figo(Malaysia). Director & Professor Head Institute Of Child & Mothers Health. Matuail,Gynaecology,Jatrabari
PDC-570,ASST. PROF. DR. MUNIRUNNESA SHILPY,"MBBS. FCPS(Gynae). Assistant Professor, Sir Salimullah medical College & Hospital",Gynaecology,Jatrabari
PDC-571,ASST. PROF. MAJOR. DR. HAFSA KABIR KAKON,MBBS. FCPS(Gynae). Assistant Professor. CMH Hospital Dhaka,Gynaecology,Jatrabari
PDC-572,DR. NASIMA AKHTER,MBBS. FCPS(Gynae). DGO (Gynae). MS ( Gynae) Sheikh Mujib Medical College University,Gynaecology,Jatrabari
PDC-573,DR. RABEYA BEGUM,MBBS.BCS.FCPS(Gynae). MCPS( Gynae) Sir Salimullah Medical College & hospital,Gynaecology,Jatrabari
PDC-574,DR. KAZI SHAMIM ARA SWEETY,MBBS. FCPS ( Endocrinology Infertility) . FCPS(Gynae) .Sheikh Mujib Medical University,Gynaecology,Jatrabari
PDC-575,DR. TAHMINA KHAN SHAMMI,MBBS.FCPS(Gynae). FCPS ( Gynae Oncology) . DMU ( Ultrasonography) Dhaka Medical College Hospital,Gynaecology,Jatrabari
PDC-576,DR. ALIF LAILA LILY,"MBBS. DGO ( Gynae). FCPS(Gynae) . Senior Consultant, Dhaka Medical College Hospital",Gynaecology,Jatrabari
PDC-577,DR. LIPIKA CHOWDHURY,,Gynaecology,Chattogram
PDC-578,DR. MORZINA KHATUN (MUKTI),"MBBS.BCS(Health)FCPS,Consultant, Laparoscopic & Hysteroscopic Surgeon Rajshahi Medical College & Hospital",Gynaecology,Rajshahi
PDC-579,DR. AFROZA SULTANA (MORNING),,Gynaecology,Mirpur
PDC-580,DR. FAIRUJ PERVIN TANIA,"MBBS, BCS (Health), FCPS (Obs&Gynae) ,Consultant, Gynae & Obs, Rajshahi Medical College & Hospital",Gynaecology,Rajshahi
PDC-581,ASST. PROF. DR. SHAMSOON NAHAR(EVENING),,Gynaecology,Uttara
PDC-582,DR. AMITUNNESHA SHIKHA,"MBBS. MS ( Obs & Gynae) . BCS , Endocrinology Infertility Department Sheikh Mujib Medical College",Gynaecology,Jatrabari
PDC-583,DR. SAYEDA AKTER NIPA,MBBS. FCPS ( Gynae & Orbs ) . CCD ( Birdem) . Dhaka National medical College Hospital,Gynaecology,Jatrabari
PDC-584,ASST. PROF. DR. PARVEN AKTER PARUL,MBBS. BCS. FCPS ( Obs & Gynae ). Assistant Professor At Mughda Medical College Hospital,Gynaecology,Jatrabari
PDC-585,DR. MANJILA MAFRAUHA KHANUM (QUEEN),"MBBS, BCS (Health) FCPS (Gynaecology & Obs), Consultant, Gynae & Obs, Rajshahi Medical College & Hospital",Gynaecology,Rajshahi
PDC-586,DR. MAJOR (RETD) ASHRULATA ROY,MBBS. FCPS ( Gynae & Obs) Obstetrician & Gynecologists' Surgeon. CMH,Gynaecology,Jatrabari
PDC-587,DR. MOSIUR RAHMAN,,Gynaecology,Barisal
PDC-588,DR. FARZANA HAMID (ETI),"MBBS, BCS (Helth), MS (Obs & Gynae) Consultant (Gynae) Dept. of Fetomaternal Medicine Bangabandhu Sheikh Mujib Medical University (Ex.PG Hospital)",Gynaecology,Dhanmondi
PDC-589,PROF.DR. NAZNIN RASHID SHEWLY,,Gynaecology,Savar
PDC-590,DR. NASRIN BEGUM (DOTY),"MBBS, DGO, (DU) , Assistant Professor Department Of Gynecology , Islami Bank Medical Collage & Hospital",Gynaecology,Rajshahi
PDC-591,DR. SHAHANAZ AKTER,"MBBS FCPS MS(Obst & Gynee) Kurmitola Genarel Hospital, Dhaka",Gynaecology,Badda
PDC-592,DR. AYESHA TASNEEM,,Gynaecology,Chattogram
PDC-593,DR. JANNATUL FERDOUSE (SAKI),"MBBS (CU); DGO (Gynae & Obs), Popular Diagnostic Centre Ltd. Noakhali Branch.",Gynaecology,Noakhali
PDC-594,PROF. DR. SAKTI DAS,"MBBS, DGO,FCPS,MS (Gyne) Ex-Professor & Dept Head. Sir Salimuallah Medical College Hospital. Mitford,Dhaka.",Gynaecology,Jatrabari
PDC-595,DR. MOST. SALMA AKHTAR ZAHAN (POLY),"MBBS, BCS (Health) FCPS (Gynae& Obs) MCPS (Gynae& Obs), Consulanat Dipartment Of Gynae& Obs , Rajshahi Medical College & Hospital",Gynaecology,Rajshahi
PDC-596,DR. SHAHNAJ SULTANA (SWEET),"MBBS, BCS (Health) FCPS (Gynae&Obs) MCPS (Gynae&Obs) , Consultanat Dipaartment Of Gynaecology , Rajshahi Medical College & Hospital",Gynaecology,Rajshahi
PDC-597,ASSOCIATE PROF. DR. SHILPI SAHA,,Gynaecology,Garib-E-Newaz
PDC-598,PROFESSOR DR. SURAIYA SULTANA,,Gynaecology,Garib-E-Newaz
PDC-599,ASSOCIATE PROF. DR. HAFIJA AKTER,,Gynaecology,Garib-E-Newaz
PDC-600,PROF DR. JESMIN AKTER,,Gynaecology,Garib-E-Newaz
PDC-601,PROF. DR. RUNA LAILA,"MBBS,FCPS,MCPS,Fartility Specialist,Advanced Diploma In Art and Reproductive Medicine (Uk),CT Medical",Gynaecology,Garib-E-Newaz
PDC-602,DR.IVY NASRIN,"MBBS (Dhaka Medical College ) BCS (Health ), FCPS (Obs. & Gynee) FCPS ( Reproductive Endocrinology & Infertility ) Specialist in Infertility, Obstrics Gynecology & Reproductive Hormones. Gynecology Laparoscopic And Hysteroscopic Surgeon. Advance Training in (IVF).",Gynaecology,Khulna
PDC-603,DR. NASIMA AKTER ( MORNING ),MBBS.FCPS(Gynae). DGO (Gynae). MS ( Gynae) Sheikh Mujib Medical College University,Gynaecology,Jatrabari
PDC-604,ASSOCIATE PROF. DR. FAHIMA AFROZE,,Gynaecology,Garib-E-Newaz
PDC-605,PROFESSOR DR. FATIMA DOLON,,Gynaecology,Garib-E-Newaz
PDC-606,DR.NAZIA BINTE ALAMGIR,,Gynaecology,Garib-E-Newaz
PDC-607,PROFESSOR DR. FERDOUS MAHAL ROONI,,Gynaecology,Garib-E-Newaz
PDC-608,DR. MANOWARA SULTANA ROSY,,Gynaecology,Chattogram
PDC-609,DR.SELINA AKTER SHILU,"MBBS, MCPS, (Obs & Gynee) Senior Consultant.Obstetrics, Gynaecology Specialist & Surgeon .BMDC Reg-15503.",Gynaecology,Khulna
PDC-610,ASSIT. PROF. DR. SOHELI NARGIS,,Gynaecology,Garib-E-Newaz
PDC-611,DR.ASHRAFUN NESA ( MOMY),"MBBS, BCS (Health) FCPS (Gynae & Obs) Gynae & Obs. Specialist & Surgeon , Rajshahi Medical College & Hospital .",Gynaecology,Rajshahi
PDC-612,ASST .PROF. NASRIN SULTANA BEAUTY,,Gynaecology,Garib-E-Newaz
PDC-613,DR. RAWSHAN ARA BEGUM,,Gynaecology,Chattogram
PDC-614,PROF. DR. SK. NURUL ALAM,,Orthopaedic Surgery,Dhanmondi
PDC-615,PROF. DR. MUHAMMAD SHAHIDUZZAMAN,,Orthopaedic Surgery,Dhanmondi
PDC-616,PROF. DR. MOINUDDIN AHMED CHOWDHURY,,Orthopaedic Surgery,Dhanmondi
PDC-617,PROF. DR. MD. ANOWARUL ISLAM,"MBBS (Dhaka), MS (Ortho), FICS (USA), FACS (USA), FRCS-(Glasgow-UK), Fellow-Spine Surgery, Professor & Division Head Spine Surgery, BSMMU",Orthopaedic Surgery,Dhanmondi
PDC-618,DR. G M REZA,"MBBS, MCPS (Surgery), D (Ortho), MS (Ortho), AAOS (USA), Fellow Joint Replacement Surgery, Apollo Hospital, Delhi. National Institute of Traumatology & Orthopaedic Rehabilitation (NITOR).",Orthopaedic Surgery,Dhanmondi
PDC-619,DR. S. A. JONAYED,,Orthopaedic Surgery,Dhanmondi
PDC-620,ASSO. PROF. DR. BABUL KUMAR SAHA,,"Orthopaedic Surgery, Orthopedics",Barisal
PDC-621,DR. SUDIP KUMAR HALDER,,"Orthopaedic Surgery, Orthopedics",Barisal
PDC-622,ASST. PROF. DR. MD. FERDOUS RAYHAN,,"Orthopaedic Surgery, Orthopedics",Barisal
PDC-623,DR. MD. MAHMUD ULLAH MAHIN,,"Orthopaedic Surgery, Orthopedics",Barisal
PDC-624,ASSO. PROF. DR. MALAY KUMAR SAHA,"MBBS,D-Ortho(NITOR),MS-Ortho(NITOR) Bone & Joint Specialist .Associate Professor,Department Of Orthopaedic Surgery.Mymensingh Medical College & Hospital,Mymensingh Ex-RS(Orthopaedics & Traumatology) Ex-RS(Casualty)",Orthopaedic Surgery,Mymensingh
PDC-625,PROF. DR. MD. SAIFUL ISLAM,"MBBS (DU),MS (Ortho),APSS Fellowship (Hongkong),Fellow APOA (Australia,Thailand),Fellowship Paediatric Orthopedics,SIOR(India),Master Training on Club Foot Management(NITOR),AO (Trauma) Basic Course & AO (Trauma) Advance Course,Member American Academy of Orthopaedic Surgeons (AAOS),Member AO Trauma,Member SICOT (Canada),Member EFORT (Portugal). Professor & Head Of The Departmet. Mymensingh Medical College & Hospital,Mymensingh.",Orthopaedic Surgery,Mymensingh
PDC-626,ASST. PROF. DR. MOHAMMAD TARIQUL ALAM (NOMAN),"MBBS (Dhaka), M.S (Orthopedic Surgery) Fellow-AOAF (India), Fellow-Paediatric Orthopedics (South Korea), Assistant Professor (Peadiatric Othopaedics). Mymensingh Medical College & Hospital, Mymensingh",Orthopaedic Surgery,Mymensingh
PDC-627,ASST. PROF. DR. BELAYET HOSSAIN (MORNING),"MBBS.(Dhaka),MS(Ortho-Surgery). Ex-Asst.Professor,Orthopedic Department. Mymensingh Medical College & Hospital.Mymensingh.",Orthopaedic Surgery,Mymensingh
PDC-628,PROF. DR. MD. NAZRUL ISLAM,"MBBS,D-ortho,Orthopedic,trauma surgeon and orthopedic,rheumatologist and surgeon,Professor and Head of Department, Holy Family Red Crescent Medical College Hospital",Orthopaedic Surgery,Shantinagar
PDC-629,ASSO. PROF. DR. MD. ALI FAISAL LITON,"MBBS,MS (Ortho Surgery),Bangabandhu Sheikh Mujib Medical University (BSMMU) Dhaka",Orthopaedic Surgery,Shantinagar
PDC-630,DR. KAMAL UDDIN AHMED,"MBBS,MS,FICS (Consultant of Popular Diagnostic Centre)",Orthopaedic Surgery,Shantinagar
PDC-631,DR. KAZI MD. HEDAYET ULLAH,"MBBS,BCS,D.Ortho (Bangladesh Bank)",Orthopaedic Surgery,Shantinagar
PDC-632,DR. O Z M DASTAGIR,"MBBS, D Ortho, MS Ortho, FACS (USA) Fellow AO Trauma (Germany) Fellow Minimal Invasive Spine Surgery (India), APOA-SIAA Fellow Arthroplasty (India), WHO Fellow Arthroplasty, Arthroscopy(India), AO Trauma (Basic, Advanced), AO Spine Basic(Nepal), AO Spine Advanced-Minimal Invasive Spine Surgery (India), Senior Consultant Spine, Ortho & Trauma Surgeon",Orthopaedic Surgery,Dhanmondi
PDC-633,ASST. PROF. DR. SHIHAB UDDIN SHIHAB,,"Orthopaedic Surgery, Orthopedics",Barisal
PDC-634,DR.MANASH CHANDRO SARKAR,,Orthopaedic Surgery,Savar
PDC-635,ASST.PROF.DR.MD.SUBIR HOSSEN,,Orthopaedic Surgery,Savar
PDC-636,DR.S.M.MOSHEEUR RAHMAN,,Orthopaedic Surgery,Savar
PDC-637,PROF.DR.S M IDRIS ALI,,"Orthopaedic Surgery, Orthopedics",Barisal
PDC-638,DR. A.J.M MUSADDEQUE REZA (RIPON),,Orthopaedic Surgery,Kushtia
PDC-639,PROF. RETD. DR. MD. MAIDUL ISLAM,"MS (Orthopaedics), FCPS (Physiatrics) Former :  Assistant Professor (Physical Medicine) - CMC Assistant Professor (Orthapaedic Surgery) - CMC Senior Consultant (Orthapaedic Surgery) - CMC Associate Professor (Orthapaedic Surgery) - USTC Professor (C.C) (Orthopaedics Surgery) - ZHSWMC&H.","Orthopaedic Surgery, Orthopedics",Noakhali
PDC-640,PROF. DR. SAMARJIT BARUA,"MBBS(DMC), MS(Ortho), AO-Sec Fellow,Ahmedabad,India, AO-Trauma(Advanced)&(Masters), Switzerland. Orthopaedic Surgeon,Puna,India, Dept. Of Head Shaheed Monsur Ali Medical College & Hospital.Uttara.",Orthopaedic Surgery,Gazipur
PDC-641,ASSO. PROF. DR. FAZLUL HAQUE QASEM,"MBBS,MS(Ortho), Fellow, Joint Replacement (India), Fellow- Trauma (South Korea & Thailand), Asso. Prof. Department Of Orthopaedic Surgery Dhaka Medical College & Hospital, Dhaka",Orthopaedic Surgery,Gazipur
PDC-642,DR. S R AHMED (RAZU),"MBBS, BCS(Health), MS(Orthopedic Surgery), Member Asis Pasific Spine Society(APSS) Trauma, Orthopedic & Spine Specialist Surgeon, National Institute of Traumatology and Orthopedic Rehabilitation (NITOR).",Orthopaedic Surgery,Gazipur
PDC-643,DR. OBAIDUL HAQUE SABBIR,,Orthopaedic Surgery,Badda
PDC-644,DR. SAZZAD HOSSAIN,,Orthopaedic Surgery,Badda
PDC-645,DR. MOIN AHMED FERDOUS RUBEL,,Orthopaedic Surgery,Badda
PDC-646,ASSOC. PROF. DR. SUBRATA KUMAR PRAMANIK,"MBBS, MS (Ortho Surgery), Associate Professor, Department of Orthopedic & Traumatology, Rajshahi Medical College & Hospital",Orthopaedic Surgery,Rajshahi
PDC-647,ASSTT. PROF. DR. DEBASHISH ROY (EVENING),"Life member: Asia Pacific Orthopedic Association, Life Member: Indian Orthopedic Association, Member : World Orthopedic Concern",Orthopaedic Surgery,Rajshahi
PDC-648,ASSTT. PROF. DR. MD. SOFIKUL ISLAM (ORTHO),"MBBS, BCS (Health), MS (Orthopedics Surgery), Assistant Professor, Department of Orthopedic Surgery, Rajshahi Medical College & Hospital",Orthopaedic Surgery,Rajshahi
PDC-649,ASSTT. PROF. DR. MD. HABIBUL HASAN,"MBBS, BCS, MCPS (Surgery), FCPS (Ortho Surgery), Asstt. Prof., Orthopedic Surgery, Rajshahi Medical College & Hospital",Orthopaedic Surgery,Rajshahi
PDC-650,PROFESSOR DR.SERAJ UDDIN AHAMMED,,Orthopaedic Surgery,Shyamoli
PDC-651,PROFESSOR. DR. SK NURUL ALOM,"MBBS(DMC)FCPS,MS-(Ortho),D-(Ortho)",Orthopaedic Surgery,Shyamoli
PDC-652,PROFESSOR. DR. MD. M SAJJAD HUSSAIN,"MBBS,MS-(Ortho),FICS(Ortho),Truma & Ortho Surgery",Orthopaedic Surgery,Shyamoli
PDC-653,PROFESSOR. DR. MD. SHOFIKUL ALOM,,Orthopaedic Surgery,Shyamoli
PDC-654,ASSO. PROF. DR. ASHRAFUL ISLAM,,Orthopaedic Surgery,English road
PDC-655,ASST.PROF. DR. A.B.M ZAKIR UDDIN,,Orthopaedic Surgery,English road
PDC-656,DR. SHAWON DATTA,,Orthopaedic Surgery,English road
PDC-657,DR. MD. MYNUL HASAN CHISHTY,,Orthopaedic Surgery,English road
PDC-658,PROF. DR. MD. ABDUR ROB,Professor,Orthopaedic Surgery,Uttara
PDC-659,PROF. BRIG. GEN. ABDUR RAHMAN MOLLAH,,Orthopaedic Surgery,Uttara
PDC-660,ASST. PROF. DR. MD. INSANUL ALAM,,Orthopaedic Surgery,Uttara
PDC-661,DR. ANANTA KUMAR BHAKTA,,Orthopaedic Surgery,Uttara
PDC-662,DR. MD. SHAHIDUL ISLAM,"MBBS, MS(Ortho) General Hospital(Victoria), Narayanganj.",Orthopaedic Surgery,Narayangonj
PDC-663,ASSO. PROF. DR. G.M REZA,"MBBS,MCPS(SURGERY),D(ORTHO),MS(ORTHO)AAOS(USA).National Institute of Traumatology and Orthopedic Rehabilitation(NITOR) (Retd.)",Orthopaedic Surgery,Narayangonj
PDC-664,ASST. PROF. DR. ALAMGIR HOSSAIN JONY,"MBBS, BCS(HEALTH), MS(ORTHOPEDIC). Mugda Medical & Hospital, Dhaka.",Orthopaedic Surgery,Narayangonj
PDC-665,PROF. DR. M.A MALEK MURAD,"MBBS(DMC),MS(ORTHO) Ad-din Medicla College Hospital",Orthopaedic Surgery,Narayangonj
PDC-666,ASST. PROF. DR. HARUN OR RASHID KHAN,"MBBS,D.ORTHO(DU),MS(ORTHO). National Institute of Traumatology and Orthopedic Rehabilitation(NITOR)",Orthopaedic Surgery,Narayangonj
PDC-667,DR. MD. KHALED MONSUR,"MBBS,D ORTHO(DU).National Institute of Traumatology and Orthopedic Rehabilitation(NITOR)",Orthopaedic Surgery,Narayangonj
PDC-668,ASST. PROF. DR. H.A RASHID,"MBBS,BCS,MS(ORTHO).Dhaka Medical College Hospital",Orthopaedic Surgery,Narayangonj
PDC-669,ASST. PROF. DR. MD. MAHBUBUR RAHMAN KHAN,"MBBS,BCS(HEALTH),MS(ORTHO SURGERY). National Institute of Traumatology and Orthopedic Rehabilitation(NITOR)",Orthopaedic Surgery,Narayangonj
PDC-670,DR. DIBAKAR SARKAR,"MBBS,BCS,MS,(ORTHO SURGERY) AO ADVANCE(INDONESIA) CONSULTANT(ORTHO-SURGERY) NITOR,DHAKA",Orthopaedic Surgery,Narayangonj
PDC-671,DR. MD. HAIDAR ALI SHIMUL,"MBBS,MS(ORTHO). Dhaka Medical College Hospital",Orthopaedic Surgery,Narayangonj
PDC-672,ASST. PROF. DR. ZAHANGIR HAWLADAR,"MBBS, D-Ortho. Kumudini Women's Medical College & Hospital",Orthopaedic Surgery,Narayangonj
PDC-673,ASSO. PROF. DR. MIZANUR RAHAMAN KALLOL,MBBS.D-ORTHO,Orthopaedic Surgery,English road
PDC-674,ASSOC.PROF. DR. MD. WADUDUL HOQUE TARAFDER (NAHID),Associate Professor,Orthopaedic Surgery,Bogura
PDC-675,ASSOC. PROF. DR. MD. REZAUL KARIM,,Orthopaedic Surgery,Bogura
PDC-676,ASSTT. PROF. DR. MD. MOHIUDDIN ASLAM (KOUSHIK),,Orthopaedic Surgery,Bogura
PDC-677,ASSTT. PROF. DR. ABDULLAH AL MUTI (SUBORNO),,Orthopaedic Surgery,Bogura
PDC-678,DR. MD. AMJAD ALI,,Orthopaedic Surgery,Mirpur
PDC-679,PROF. DR. SAYEDUR RAHMAN,,Orthopaedic Surgery,Mirpur
PDC-680,PROF. BRIG.GEN. DR. MD. SHAHIDULLAH,,Orthopaedic Surgery,Mirpur
PDC-681,PROF. DR. ERSHADUL HAQUE,,Orthopaedic Surgery,Mirpur
PDC-682,ASSO. PROF. DR. MD. KAMRUZZAMAN,,Orthopaedic Surgery,Mirpur
PDC-683,DR. MAHAMUD MANNAN,,Orthopaedic Surgery,Mirpur
PDC-684,ASST. PROF. DR. MD. AMIRUL ISLAM,,"Orthopaedic Surgery, Orthopedics",Barisal
PDC-685,ASSO. PROF. DR. M A MOMEN,Associate Professor,Orthopaedic Surgery,Rangpur
PDC-686,ASST. PROF. DR. A B M MORSHED GONI,Assistant Professor,Orthopaedic Surgery,Rangpur
PDC-687,DR. MIR SHAHIDUL HASAN SHAHIN,,"Orthopaedic Surgery, Orthopedics",Barisal
PDC-688,ASST. PROF. DR. MD. WBAYDUR RAHMAN (WBAYED),,Orthopaedic Surgery,Gazipur
PDC-689,ASST. PROF. DR. MD. SHAHIDULLAH,,Orthopaedic Surgery,Kushtia
PDC-690,DR. A.K.M.NAZMUL HAQUE,MBBS.BCS ( Health). MS (Orthosurgery). NITOR. Consultant (Orthopedic Department). Mymensingh Medical College & Hospital.,Orthopaedic Surgery,Mymensingh
PDC-691,PROF. DR. MD. SAIDUL ISLAM,"MBBS (DMC), MS (Orthopeadics Surgery ), Professor , Department of Orthopeadic, Dhaka Medical College, Dhaka.",Orthopaedic Surgery,Dhanmondi
PDC-692,PROF.DR.SAMARJIT BARUA,,Orthopaedic Surgery,Uttara
PDC-693,PROF. DR. MD. KAMRUL AHSAN,Professor,Orthopaedic Surgery,Dinajpur
PDC-694,DR. MD. ABU ZAKER HOSSAIN SARKER,,Orthopaedic Surgery,Dinajpur
PDC-695,DR. FAZLAY RABBY KHAN,,"Orthopaedic Surgery, Orthopedics",Barisal
